{
  "version": "0.1.0",
  "tree": [
    {
      "id": "node-home",
      "label": "Home",
      "termId": "home"
    },
    {
      "id": "eq-filters",
      "label": "EQ & filters",
      "children": [
        {
          "id": "node-peaking-eq",
          "label": "Peaking EQ (bell)",
          "termId": "peaking-eq"
        },
        {
          "id": "node-low-pass",
          "label": "Low-pass (high-cut)",
          "termId": "low-pass"
        },
        {
          "id": "node-high-pass",
          "label": "High-pass (low-cut)",
          "termId": "high-pass"
        },
        {
          "id": "node-low-shelf",
          "label": "Low shelf",
          "termId": "low-shelf"
        },
        {
          "id": "node-high-shelf",
          "label": "High shelf",
          "termId": "high-shelf"
        },
        {
          "id": "node-notch",
          "label": "Notch (band-reject)",
          "termId": "notch"
        },
        {
          "id": "node-band-pass",
          "label": "Band-pass",
          "termId": "band-pass"
        },
        {
          "id": "node-all-pass",
          "label": "All-pass",
          "termId": "all-pass"
        },
        {
          "id": "node-q-bandwidth",
          "label": "Q / bandwidth",
          "termId": "q-bandwidth"
        },
        {
          "id": "node-slope-db-oct",
          "label": "Slope (dB/octave)",
          "termId": "slope-db-oct"
        },
        {
          "id": "node-cutoff",
          "label": "Cutoff frequency",
          "termId": "cutoff"
        },
        {
          "id": "node-resonance",
          "label": "Resonance",
          "termId": "resonance"
        },
        {
          "id": "node-butterworth",
          "label": "Butterworth",
          "termId": "butterworth"
        },
        {
          "id": "node-linkwitz-riley",
          "label": "Linkwitz-Riley",
          "termId": "linkwitz-riley"
        },
        {
          "id": "node-graphic-eq",
          "label": "Graphic EQ",
          "termId": "graphic-eq"
        },
        {
          "id": "node-linear-vs-minimum-phase",
          "label": "Linear-phase vs minimum-phase",
          "termId": "linear-vs-minimum-phase"
        }
      ]
    },
    {
      "id": "dynamics",
      "label": "Dynamics",
      "children": [
        {
          "id": "node-compressor",
          "label": "Compressor",
          "termId": "compressor"
        },
        {
          "id": "node-limiter",
          "label": "Limiter",
          "termId": "limiter"
        },
        {
          "id": "node-expander",
          "label": "Expander",
          "termId": "expander"
        },
        {
          "id": "node-gate",
          "label": "Noise gate",
          "termId": "gate"
        },
        {
          "id": "node-ducking",
          "label": "Ducking",
          "termId": "ducking"
        },
        {
          "id": "node-sidechain",
          "label": "Sidechain",
          "termId": "sidechain"
        },
        {
          "id": "node-threshold",
          "label": "Threshold",
          "termId": "threshold"
        },
        {
          "id": "node-ratio",
          "label": "Ratio",
          "termId": "ratio"
        },
        {
          "id": "node-attack-release",
          "label": "Attack / release",
          "termId": "attack-release"
        },
        {
          "id": "node-knee",
          "label": "Knee",
          "termId": "knee"
        },
        {
          "id": "node-makeup-gain",
          "label": "Makeup gain",
          "termId": "makeup-gain"
        },
        {
          "id": "node-parallel-compression",
          "label": "Parallel compression",
          "termId": "parallel-compression"
        },
        {
          "id": "node-multiband-dynamics",
          "label": "Multiband dynamics",
          "termId": "multiband-dynamics"
        },
        {
          "id": "node-upward-compression",
          "label": "Upward compression",
          "termId": "upward-compression"
        }
      ]
    },
    {
      "id": "time-space",
      "label": "Time & space",
      "children": [
        {
          "id": "node-delay",
          "label": "Delay",
          "termId": "delay"
        },
        {
          "id": "node-slapback",
          "label": "Slapback delay",
          "termId": "slapback"
        },
        {
          "id": "node-ping-pong",
          "label": "Ping-pong delay",
          "termId": "ping-pong"
        },
        {
          "id": "node-reverb",
          "label": "Reverb",
          "termId": "reverb"
        },
        {
          "id": "node-pre-delay",
          "label": "Pre-delay",
          "termId": "pre-delay"
        },
        {
          "id": "node-dry-wet",
          "label": "Dry / wet",
          "termId": "dry-wet"
        },
        {
          "id": "node-convolution",
          "label": "Convolution",
          "termId": "convolution"
        }
      ]
    },
    {
      "id": "modulation",
      "label": "Pitch & modulation",
      "children": [
        {
          "id": "node-chorus",
          "label": "Chorus",
          "termId": "chorus"
        },
        {
          "id": "node-flanger",
          "label": "Flanger",
          "termId": "flanger"
        },
        {
          "id": "node-phaser",
          "label": "Phaser",
          "termId": "phaser"
        },
        {
          "id": "node-tremolo",
          "label": "Tremolo",
          "termId": "tremolo"
        },
        {
          "id": "node-vibrato",
          "label": "Vibrato",
          "termId": "vibrato"
        },
        {
          "id": "node-pitch-shift",
          "label": "Pitch shift",
          "termId": "pitch-shift"
        },
        {
          "id": "node-autotune",
          "label": "Pitch correction (Auto-Tune)",
          "termId": "autotune"
        }
      ]
    },
    {
      "id": "utility-routing",
      "label": "Utility & routing",
      "children": [
        {
          "id": "node-gain-preamp",
          "label": "Gain / preamp",
          "termId": "gain-preamp"
        },
        {
          "id": "node-pan",
          "label": "Pan",
          "termId": "pan"
        },
        {
          "id": "node-balance",
          "label": "Balance",
          "termId": "balance"
        },
        {
          "id": "node-mute-solo",
          "label": "Mute / solo",
          "termId": "mute-solo"
        },
        {
          "id": "node-bus-aux",
          "label": "Bus / aux / send / return",
          "termId": "bus-aux"
        },
        {
          "id": "node-insert",
          "label": "Insert",
          "termId": "insert"
        },
        {
          "id": "node-phase-invert",
          "label": "Phase invert (polarity)",
          "termId": "phase-invert"
        },
        {
          "id": "node-mono-sum",
          "label": "Mono sum",
          "termId": "mono-sum"
        },
        {
          "id": "node-stereo-width",
          "label": "Stereo width",
          "termId": "stereo-width"
        },
        {
          "id": "node-mid-side",
          "label": "Mid / Side (M/S)",
          "termId": "mid-side"
        },
        {
          "id": "node-dither",
          "label": "Dither",
          "termId": "dither"
        },
        {
          "id": "node-sample-rate",
          "label": "Sample rate",
          "termId": "sample-rate"
        },
        {
          "id": "node-bit-depth",
          "label": "Bit depth",
          "termId": "bit-depth"
        },
        {
          "id": "node-latency",
          "label": "Latency",
          "termId": "latency"
        },
        {
          "id": "node-buffering",
          "label": "Buffering",
          "termId": "buffering"
        }
      ]
    },
    {
      "id": "metering",
      "label": "Metering & analysis",
      "children": [
        {
          "id": "node-peak",
          "label": "Peak",
          "termId": "peak"
        },
        {
          "id": "node-rms",
          "label": "RMS",
          "termId": "rms"
        },
        {
          "id": "node-lufs",
          "label": "LUFS / LKFS",
          "termId": "lufs"
        },
        {
          "id": "node-true-peak",
          "label": "True peak",
          "termId": "true-peak"
        },
        {
          "id": "node-spectrum",
          "label": "Spectrum analyzer",
          "termId": "spectrum"
        },
        {
          "id": "node-spectrogram",
          "label": "Spectrogram",
          "termId": "spectrogram"
        },
        {
          "id": "node-correlation",
          "label": "Stereo correlation",
          "termId": "correlation"
        },
        {
          "id": "node-crest-factor",
          "label": "Crest factor",
          "termId": "crest-factor"
        }
      ]
    },
    {
      "id": "broadcast-live",
      "label": "Broadcast, live & OBS",
      "children": [
        {
          "id": "node-noise-suppression",
          "label": "Noise suppression",
          "termId": "noise-suppression"
        },
        {
          "id": "node-noise-gate-live",
          "label": "Noise gate (live/OBS)",
          "termId": "noise-gate-live"
        },
        {
          "id": "node-vst-host",
          "label": "VST / plugin host",
          "termId": "vst-host"
        },
        {
          "id": "node-apo",
          "label": "APO (Audio Processing Object)",
          "termId": "apo"
        },
        {
          "id": "node-loudness-norm",
          "label": "Loudness normalization",
          "termId": "loudness-norm"
        },
        {
          "id": "node-duck-under-voice",
          "label": "Duck under voice",
          "termId": "duck-under-voice"
        },
        {
          "id": "node-monitor-vs-program",
          "label": "Monitor vs program",
          "termId": "monitor-vs-program"
        }
      ]
    }
  ],
  "terms": {
    "home": {
      "aliases": [
        "home",